{
  "review_id": "00000000-0000-4000-8000-000000000005",
  "action": "accept",
  "proposal_states": {
    "00000000-0000-4000-8000-000000000001": "accepted"
  },
  "proposal_versions": {
    "00000000-0000-4000-8000-000000000001": 2
  },
  "approved_record_ids": ["00000000-0000-4000-8000-000000000006"],
  "approved_versions": [
    {
      "record_id": "00000000-0000-4000-8000-000000000006",
      "version_id": "00000000-0000-4000-8000-000000000007",
      "version": 1,
      "etag": "\"1\""
    }
  ],
  "resolved_conflicts": [
    {
      "conflict_id": "00000000-0000-4000-8000-000000000004",
      "etag": "\"group-v2\""
    }
  ]
}
